<?xml version="1.0" encoding="UTF-8"?>
<tests xmlns:xsi="http://www.w3.org/2001/XMLSchema-instance" xsi:noNamespaceSchemaLocation="soapui-project-conf.xsd">
  <test name="DocRetrieve-OneDocument(1tx1r)" testcase="Nhin.DocRetrieve.SingleDocument" numberOfThreads="1" numberOfIteration="1">
    <testProperties filename="DocRetrieveLoadTest-soapui-project.properties">
      <property name="DocRetrieve.HomeCommunityId">${#Project#Endpoint-HomeCommunityId}</property>  
      <property name="DocRetrieve.RepositoryId">1</property>
      <property name="DocRetrieve.DocumentId">1.123402.11111</property>
      <property name="DocRetrieve.ExpectedSizeOfDocuments">35000</property>
    </testProperties>
  </test>

  <test name="DocRetrieve-OneDocument(1tx50r)" testcase="Nhin.DocRetrieve.SingleDocument" numberOfThreads="1" numberOfIteration="50">
    <testProperties filename="DocRetrieveLoadTest-soapui-project.properties">
      <property name="DocRetrieve.HomeCommunityId">${#Project#Endpoint-HomeCommunityId}</property>  
      <property name="DocRetrieve.RepositoryId">1</property>
      <property name="DocRetrieve.DocumentId">1.123402.11111</property>
      <property name="DocRetrieve.ExpectedSizeOfDocuments">35000</property>
    </testProperties>
  </test>
  <test name="DocRetrieve-OneDocument(2tx50r)" testcase="Nhin.DocRetrieve.SingleDocument" numberOfThreads="2" numberOfIteration="50">
    <testProperties filename="DocRetrieveLoadTest-soapui-project.properties">
      <property name="DocRetrieve.HomeCommunityId">${#Project#Endpoint-HomeCommunityId}</property>  
      <property name="DocRetrieve.RepositoryId">1</property>
      <property name="DocRetrieve.DocumentId">1.123402.11111</property>
      <property name="DocRetrieve.ExpectedSizeOfDocuments">35000</property>
    </testProperties>
  </test>
  <test name="DocRetrieve-OneDocument(5tx50r)" testcase="Nhin.DocRetrieve.SingleDocument" numberOfThreads="5" numberOfIteration="50">
    <testProperties filename="DocRetrieveLoadTest-soapui-project.properties">
      <property name="DocRetrieve.HomeCommunityId">${#Project#Endpoint-HomeCommunityId}</property>  
      <property name="DocRetrieve.RepositoryId">1</property>
      <property name="DocRetrieve.DocumentId">1.123402.11111</property>
      <property name="DocRetrieve.ExpectedSizeOfDocuments">35000</property>
    </testProperties>
  </test>
  <test name="DocRetrieve-OneDocument(10tx50r)" testcase="Nhin.DocRetrieve.SingleDocument" numberOfThreads="10" numberOfIteration="50">
    <testProperties filename="DocRetrieveLoadTest-soapui-project.properties">
      <property name="DocRetrieve.HomeCommunityId">${#Project#Endpoint-HomeCommunityId}</property>  
      <property name="DocRetrieve.RepositoryId">1</property>
      <property name="DocRetrieve.DocumentId">1.123402.11111</property>
      <property name="DocRetrieve.ExpectedSizeOfDocuments">35000</property>
    </testProperties>
  </test>
  <test name="DocRetrieve-OneDocument(25tx50r)" testcase="Nhin.DocRetrieve.SingleDocument" numberOfThreads="25" numberOfIteration="50">
    <testProperties filename="DocRetrieveLoadTest-soapui-project.properties">
      <property name="DocRetrieve.HomeCommunityId">${#Project#Endpoint-HomeCommunityId}</property>  
      <property name="DocRetrieve.RepositoryId">1</property>
      <property name="DocRetrieve.DocumentId">1.123402.11111</property>
      <property name="DocRetrieve.ExpectedSizeOfDocuments">35000</property>
    </testProperties>
  </test>

  <test name="DocRetrieve-OneDocument(1tx1000r)" testcase="Nhin.DocRetrieve.SingleDocument" numberOfThreads="1" numberOfIteration="1000">
    <testProperties filename="DocRetrieveLoadTest-soapui-project.properties">
      <property name="DocRetrieve.HomeCommunityId">${#Project#Endpoint-HomeCommunityId}</property>  
      <property name="DocRetrieve.RepositoryId">1</property>
      <property name="DocRetrieve.DocumentId">1.123402.11111</property>
      <property name="DocRetrieve.ExpectedSizeOfDocuments">35000</property>
    </testProperties>
  </test>
  <test name="DocRetrieve-NoDocument(1tx1000r)" testcase="Nhin.DocRetrieve.SingleDocument" numberOfThreads="1" numberOfIteration="1000">
    <testProperties filename="DocRetrieveLoadTest-soapui-project.properties">
      <property name="DocRetrieve.HomeCommunityId">${#Project#Endpoint-HomeCommunityId}</property>  
      <property name="DocRetrieve.RepositoryId">1</property>
      <property name="DocRetrieve.DocumentId">x</property>
    </testProperties>
  </test>

  <test name="DocRetrieve-SequentialRequestsForMultipleDocuments(1tx50r)" testcase="Nhin.DocRetrieve.SequentialRequestsForMultipleDocuments" numberOfThreads="1" numberOfIteration="20">
    <testProperties filename="DocRetrieveLoadTest-soapui-project.properties">
      <property name="DocRetrieve.HomeCommunityId">${#Project#Endpoint-HomeCommunityId}</property>  
      <property name="DocRetrieve.RepositoryId">1</property>
      <property name="DocRetrieve.DocumentId-1">1.123409.44444</property>
      <property name="DocRetrieve.DocumentId-2">1.123407.11111</property>
      <property name="DocRetrieve.DocumentId-3">1.123407.22222</property>
      <property name="DocRetrieve.DocumentId-4">1.123407.33333</property>
      <property name="DocRetrieve.DocumentId-5">1.123407.44444</property>
    </testProperties>
  </test>

</tests>